{
  "schema_version": "1.0",
  "workspace_id": "ws_cumcm_2026",
  "stage": "model_design",
  "gates": {
    "gate_1_problem": "approved",
    "gate_2_model": "pending",
    "gate_3_outline": "pending",
    "gate_4_submission": "pending"
  },
  "latest_artifact_ids": ["art_problem_statement"],
  "updated_at": "2026-09-10T10:15:00+08:00"
}
